{
  "$schema": "https://json-schema.org/draft/2020-12/schema",
  "$id": "mem-graph://evals/profile-aware-workflow/cases.schema.json",
  "title": "Step 4 Phase 4A profile-aware workflow evaluation contract",
  "description": "Deterministic machine-readable contract for evaluating the complete profile-aware workflow before AGY changes agent-practice guidance. Each case encodes both arms (control = full + legacy; candidate = agent + compact) for one of the eight frozen Step 3 progressive-disclosure intentions.",
  "type": "object",
  "required": [
    "schema_version",
    "fixture_policy",
    "frozen_thresholds",
    "agent_profile_tool_names",
    "maintenance_profile_tool_names",
    "rejected_tool_families",
    "volatile_field_exclusions",
    "deterministic_field_exclusions",
    "expansion_reasons",
    "compact_orientation_statuses",
    "compact_task_slot_statuses",
    "compact_task_state_values",
    "cases",
    "counterexamples"
  ],
  "additionalProperties": false,
  "properties": {
    "$schema": { "type": "string", "const": "./cases.schema.json" },
    "schema_version": { "const": "1.0.0" },
    "fixture_policy": {
      "const": "synthetic-only",
      "description": "Fixtures must be synthetic; no personal path, live database path, private key, or provider credential may appear in any tracked artifact."
    },
    "frozen_thresholds": { "$ref": "#/$defs/frozen_thresholds" },
    "agent_profile_tool_names": {
      "type": "array",
      "minItems": 10,
      "maxItems": 10,
      "uniqueItems": true,
      "items": { "type": "string" },
      "description": "The 10 everyday tools exposed by the committed agent profile."
    },
    "maintenance_profile_tool_names": {
      "type": "array",
      "minItems": 18,
      "maxItems": 18,
      "uniqueItems": true,
      "items": { "type": "string" },
      "description": "The 18 maintenance-only tools the agent profile must never name."
    },
    "rejected_tool_families": {
      "type": "array",
      "minItems": 1,
      "uniqueItems": true,
      "items": { "type": "string" },
      "description": "Wrapper or family prefixes that must never appear as a tool name in any agent case."
    },
    "volatile_field_exclusions": {
      "type": "array",
      "minItems": 1,
      "uniqueItems": true,
      "items": { "type": "string" },
      "description": "Field names excluded from determinism hashes."
    },
    "deterministic_field_exclusions": {
      "type": "array",
      "minItems": 0,
      "uniqueItems": true,
      "items": { "type": "string" },
      "description": "Specific JSON pointers excluded from the per-case determinism hash."
    },
    "expansion_reasons": {
      "type": "array",
      "minItems": 1,
      "uniqueItems": true,
      "items": {
        "type": "string",
        "enum": [
          "verify_authority",
          "content_omitted",
          "history_requested",
          "contradiction_requires_review",
          "version_mismatch",
          "source_unavailable",
          "route_unavailable"
        ]
      },
      "description": "Committed CompactExpansion reason values; contract references must use only these strings."
    },
    "compact_orientation_statuses": {
      "type": "array",
      "items": { "type": "string", "enum": ["complete", "partial", "unavailable"] }
    },
    "compact_task_slot_statuses": {
      "type": "array",
      "items": { "type": "string", "enum": ["governing", "context_only", "unresolved"] }
    },
    "compact_task_state_values": {
      "type": "array",
      "items": { "type": "string", "enum": ["not_requested", "assembled", "unavailable"] }
    },
    "cases": {
      "type": "array",
      "minItems": 8,
      "maxItems": 8,
      "items": { "$ref": "#/$defs/step4_case" }
    },
    "counterexamples": {
      "type": "array",
      "minItems": 1,
      "items": { "$ref": "#/$defs/counterexample" },
      "description": "Top-level counterexample list, each entry carrying case_id, arm, expected_failure_code, and detection_reason. Families 1, 2, 3, 4, 5, 6, 7, 8, 9, 10 cover the required violation set."
    }
  },
  "$defs": {
    "frozen_thresholds": {
      "type": "object",
      "required": [
        "large_legacy_min_bytes",
        "large_legacy_candidate_reduction_pct",
        "small_legacy_max_growth_pct",
        "median_call_increase_max",
        "median_context_bytes_must_not_increase",
        "unsupported_argument_retry_max",
        "deterministic_field_exclusion_token"
      ],
      "additionalProperties": false,
      "properties": {
        "large_legacy_min_bytes": { "const": 8192 },
        "large_legacy_candidate_reduction_pct": { "const": 30 },
        "small_legacy_max_growth_pct": { "const": 10 },
        "median_call_increase_max": { "const": 1 },
        "median_context_bytes_must_not_increase": { "const": true },
        "unsupported_argument_retry_max": { "const": 1 },
        "deterministic_field_exclusion_token": { "type": "string", "minLength": 1 }
      }
    },
    "step4_case": {
      "type": "object",
      "required": [
        "id",
        "source_case_id",
        "workflow",
        "description",
        "arms"
      ],
      "additionalProperties": false,
      "properties": {
        "id": { "type": "string", "pattern": "^pd-[0-9]{2}-[a-z0-9-]+$" },
        "source_case_id": { "type": "string", "pattern": "^pd-[0-9]{2}-[a-z0-9-]+$" },
        "workflow": {
          "type": "array",
          "minItems": 1,
          "items": {
            "enum": ["orient", "find-and-inspect", "record-and-revise", "review-and-learn"]
          }
        },
        "description": { "type": "string", "minLength": 1 },
        "arms": {
          "type": "object",
          "required": ["control", "candidate"],
          "additionalProperties": false,
          "properties": {
            "control": { "$ref": "#/$defs/step4_arm" },
            "candidate": { "$ref": "#/$defs/step4_arm" },
            "explicit_global_subfixture": { "$ref": "#/$defs/explicit_global_subfixture" }
          }
        }
      }
    },
    "explicit_global_subfixture": {
      "type": "object",
      "required": ["case_id", "intent", "synthetic_request", "required_response_envelope_predicates", "expected_outcome"],
      "additionalProperties": false,
      "properties": {
        "case_id": { "type": "string", "pattern": "^pd-[0-9]{2}-[a-z0-9-]+$" },
        "intent": { "type": "string", "minLength": 1 },
        "synthetic_request": {
          "type": "object",
          "required": ["project_id", "response_mode", "include_global"],
          "properties": {
            "project_id": { "type": "string", "minLength": 1 },
            "query": { "type": "string", "minLength": 1 },
            "include_global": { "const": true },
            "response_mode": { "const": "compact" }
          }
        },
        "required_response_envelope_predicates": {
          "type": "array",
          "items": { "$ref": "#/$defs/compact_case_predicate" }
        },
        "expected_outcome": { "type": "string", "minLength": 1 }
      }
    },
    "step4_arm": {
      "type": "object",
      "required": [
        "profile",
        "bootstrap_response_mode",
        "synthetic_request",
        "allowed_tool_names",
        "prohibited_tool_names_or_families",
        "required_tool_calls",
        "allowed_call_cardinality",
        "required_ordering_relationships",
        "required_argument_predicates",
        "response_predicates",
        "expected_scope",
        "expected_bootstrap_mutation_or_access_behavior",
        "expected_expansion_behavior",
        "expected_outcome",
        "measurement_status",
        "metric_policy"
      ],
      "additionalProperties": false,
      "properties": {
        "profile": { "type": "string", "enum": ["full", "agent"] },
        "bootstrap_response_mode": { "type": "string", "enum": ["legacy", "compact"] },
        "synthetic_request": { "$ref": "#/$defs/synthetic_request" },
        "allowed_tool_names": {
          "type": "array",
          "minItems": 1,
          "uniqueItems": true,
          "items": { "type": "string" }
        },
        "prohibited_tool_names_or_families": {
          "type": "array",
          "items": { "type": "string" }
        },
        "required_tool_calls": { "$ref": "#/$defs/required_tool_calls" },
        "allowed_call_cardinality": { "$ref": "#/$defs/cardinality" },
        "required_ordering_relationships": {
          "type": "array",
          "items": { "$ref": "#/$defs/ordering_relationship" }
        },
        "required_argument_predicates": {
          "type": "array",
          "items": { "$ref": "#/$defs/compact_case_predicate" }
        },
        "response_predicates": {
          "type": "array",
          "items": { "$ref": "#/$defs/compact_case_predicate" }
        },
        "expected_scope": { "$ref": "#/$defs/expected_scope" },
        "expected_bootstrap_mutation_or_access_behavior": { "$ref": "#/$defs/bootstrap_behavior" },
        "expected_expansion_behavior": { "$ref": "#/$defs/expansion_behavior" },
        "expected_outcome": {
          "type": "string",
          "enum": ["orient", "orient-and-verify", "refresh-required", "unavailable-honest"]
        },
        "measurement_status": {
          "type": "string",
          "const": "contract-only-not-executed"
        },
        "metric_policy": { "$ref": "#/$defs/metric_policy" }
      }
    },
    "synthetic_request": {
      "type": "object",
      "required": ["project_id"],
      "additionalProperties": false,
      "properties": {
        "project_id": { "type": "string", "minLength": 1 },
        "query": { "type": "string", "minLength": 1 },
        "include_global": { "type": "boolean" },
        "response_mode": { "type": "string", "enum": ["legacy", "compact"] },
        "canonical_ids": { "type": "array", "items": { "type": "integer", "minimum": 1 } },
        "include_canonical_content": { "type": "boolean" },
        "task_state": { "type": "object" }
      },
      "description": "The bootstrap request mirrors the public schema in src/tools/cognitive.ts; evaluation-only comparison inputs are forbidden."
    },
    "required_tool_calls": {
      "type": "object",
      "required": ["min_count", "calls"],
      "additionalProperties": false,
      "properties": {
        "min_count": { "type": "integer", "minimum": 0 },
        "calls": {
          "type": "array",
          "items": { "$ref": "#/$defs/required_call" }
        },
        "excluded_tools": {
          "type": "array",
          "items": { "type": "string" }
        }
      }
    },
    "required_call": {
      "type": "object",
      "required": ["tool"],
      "additionalProperties": false,
      "properties": {
        "tool": { "type": "string", "minLength": 1 },
        "operation": { "type": "string", "minLength": 1 },
        "occurrence": { "type": "integer", "minimum": 0, "description": "0-indexed occurrence index when the same tool appears multiple times in a transcript." },
        "args_predicates": {
          "type": "array",
          "items": { "$ref": "#/$defs/compact_case_predicate" }
        },
        "response_predicates": {
          "type": "array",
          "items": { "$ref": "#/$defs/compact_case_predicate" }
        },
        "expansion_route": { "$ref": "#/$defs/expansion_route" }
      }
    },
    "expansion_route": {
      "type": "object",
      "additionalProperties": false,
      "properties": {
        "route_available": { "type": "boolean" },
        "tool_in_active_profile": { "type": "boolean" },
        "args_validate_structurally": { "type": "boolean" },
        "preserve_scope": { "type": "boolean" }
      }
    },
    "cardinality": {
      "type": "object",
      "required": ["min", "max"],
      "additionalProperties": false,
      "properties": {
        "min": { "type": "integer", "minimum": 1 },
        "max": { "type": "integer", "minimum": 1 }
      }
    },
    "ordering_relationship": {
      "type": "object",
      "required": ["type", "predecessor", "successor"],
      "additionalProperties": false,
      "properties": {
        "type": {
          "type": "string",
          "enum": ["bootstrap_before_mutation", "must_precede", "must_follow", "consecutive"]
        },
        "predecessor": { "type": "string", "minLength": 1 },
        "successor": { "type": "string", "minLength": 1 }
      }
    },
    "expected_scope": {
      "type": "object",
      "required": ["project_id", "include_global", "global_inclusion", "preserve_originating_scope"],
      "additionalProperties": false,
      "properties": {
        "project_id": { "type": "string", "minLength": 1 },
        "include_global": { "type": "boolean" },
        "global_inclusion": {
          "type": "string",
          "enum": ["disabled", "explicit"],
          "description": "Production CompactBootstrapV1 and AgentBootstrapResult only emit 'disabled' or 'explicit'. 'enabled' and 'n/a' are stale and rejected."
        },
        "preserve_originating_scope": { "type": "boolean" }
      }
    },
    "bootstrap_behavior": {
      "type": "object",
      "required": ["writes_database", "touches_access_tracking"],
      "additionalProperties": false,
      "properties": {
        "writes_database": { "type": "boolean", "const": false },
        "touches_access_tracking": { "type": "boolean", "const": false }
      }
    },
    "expansion_behavior": {
      "type": "object",
      "required": ["must_call_required_expansions", "may_call_optional_expansions"],
      "additionalProperties": false,
      "properties": {
        "must_call_required_expansions": { "type": "boolean" },
        "may_call_optional_expansions": { "type": "boolean" }
      }
    },
    "metric_policy": {
      "type": "object",
      "required": [
        "record_correctness",
        "record_initial_bytes",
        "record_total_context_bytes",
        "record_calls",
        "record_latency",
        "record_unsupported_arguments",
        "record_wrong_tool_attempts",
        "record_scope",
        "record_mutation_results",
        "exclude_latency_from_determinism",
        "claim_provider_token_savings",
        "applies_large_or_small_threshold"
      ],
      "additionalProperties": false,
      "properties": {
        "record_correctness": { "type": "boolean", "const": true },
        "record_initial_bytes": { "type": "boolean", "const": true },
        "record_total_context_bytes": { "type": "boolean", "const": true },
        "record_calls": { "type": "boolean", "const": true },
        "record_latency": { "type": "boolean", "const": true },
        "record_unsupported_arguments": { "type": "boolean", "const": true },
        "record_wrong_tool_attempts": { "type": "boolean", "const": true },
        "record_scope": { "type": "boolean", "const": true },
        "record_mutation_results": { "type": "boolean", "const": true },
        "exclude_latency_from_determinism": { "type": "boolean", "const": true },
        "claim_provider_token_savings": { "type": "boolean", "const": false },
        "applies_large_or_small_threshold": {
          "type": "string",
          "enum": ["large", "small", "n/a"]
        }
      }
    },
    "counterexample": {
      "type": "object",
      "required": ["family", "case_id", "arm", "expected_failure_code", "detection_reason"],
      "additionalProperties": false,
      "properties": {
        "family": { "type": "integer", "minimum": 1, "maximum": 10 },
        "case_id": { "type": "string", "pattern": "^pd-[0-9]{2}-[a-z0-9-]+$" },
        "arm": { "type": "string", "enum": ["control", "candidate"] },
        "expected_failure_code": {
          "type": "string",
          "enum": [
            "tool_not_in_profile",
            "excluded_tool_present",
            "cardinality_out_of_range",
            "ordering_violation",
            "required_call_missing",
            "required_call_arg_mismatch",
            "required_call_response_mismatch",
            "expansion_route_unavailable_called",
            "scope_not_preserved",
            "access_tracking_lie",
            "bootstrap_mutation_violation",
            "compact_response_mode_missing",
            "legacy_response_mode_unexpected",
            "pd06_version_mismatch_fabrication",
            "retry_count_exceeded",
            "response_predicate_failed",
            "required_argument_predicate_failed",
            "predicate_invalid"
          ]
        },
        "detection_reason": { "type": "string", "minLength": 1 }
      }
    },
    "compact_case_predicate": {
      "type": "object",
      "required": ["pointer", "operator"],
      "additionalProperties": false,
      "properties": {
        "pointer": {
          "type": "string",
          "pattern": "^(?:/(?:~0|~1|[^~/])*)*$"
        },
        "operator": {
          "type": "string",
          "enum": ["equals", "includes", "excludes", "exists", "not_exists"]
        },
        "value": {
          "type": ["string", "number", "boolean", "null", "object"]
        }
      },
      "allOf": [
        {
          "if": {
            "properties": { "operator": { "enum": ["equals", "includes", "excludes"] } },
            "required": ["operator"]
          },
          "then": { "required": ["value"] }
        },
        {
          "if": {
            "properties": { "operator": { "enum": ["exists", "not_exists"] } },
            "required": ["operator"]
          },
          "then": { "not": { "required": ["value"] } }
        }
      ]
    }
  }
}
