{
  "$schema": "./cases.schema.json",
  "schema_version": "1.0.0",
  "fixture_policy": "synthetic-only",
  "frozen_thresholds": {
    "large_legacy_min_bytes": 8192,
    "large_legacy_candidate_reduction_pct": 30,
    "small_legacy_max_growth_pct": 10,
    "median_call_increase_max": 1,
    "median_context_bytes_must_not_increase": true,
    "unsupported_argument_retry_max": 1,
    "deterministic_field_exclusion_token": "volatiles_excluded_for_determinism"
  },
  "agent_profile_tool_names": [
    "cognitive_agent_bootstrap",
    "memory_prime",
    "memory_find",
    "memory_read",
    "memory_write",
    "epistemic_inspect",
    "epistemic_admit",
    "epistemic_append_receipt",
    "cognitive_event_append",
    "cognitive_event_read"
  ],
  "maintenance_profile_tool_names": [
    "cognitive_policy_create",
    "cognitive_policy_evaluate",
    "cognitive_policy_lookup",
    "epistemic_integrity_check",
    "list_databases",
    "memory_boost",
    "memory_categories",
    "memory_decay",
    "memory_import_from_mem_sol",
    "memory_overview",
    "memory_projects",
    "memory_spread_stats",
    "memory_stale",
    "memory_stats",
    "memory_synapse_create",
    "sql_execute",
    "sql_introspect",
    "sql_query"
  ],
  "rejected_tool_families": [
    "memory_admin",
    "cognitive_policy",
    "cognitive_bootstrap",
    "sql_substrate",
    "mem_graph"
  ],
  "volatile_field_exclusions": [
    "compact_digest",
    "bootstrap_digest",
    "task_state_envelope_digest",
    "task_state_packet_digest",
    "evaluated_at",
    "updated_at",
    "scanned_at",
    "created_at",
    "observed_at",
    "latency_ms",
    "wall_clock_ms",
    "elapsed_ms"
  ],
  "deterministic_field_exclusions": [
    "/transcript/*/latency_ms",
    "/transcript/*/started_at",
    "/transcript/*/finished_at",
    "/transcript/*/response_envelope/evaluated_at",
    "/transcript/*/response_envelope/bootstrap_digest",
    "/transcript/*/response_envelope/compact_digest"
  ],
  "expansion_reasons": [
    "verify_authority",
    "content_omitted",
    "history_requested",
    "contradiction_requires_review",
    "version_mismatch",
    "source_unavailable",
    "route_unavailable"
  ],
  "compact_orientation_statuses": ["complete", "partial", "unavailable"],
  "compact_task_slot_statuses": ["governing", "context_only", "unresolved"],
  "compact_task_state_values": ["not_requested", "assembled", "unavailable"],
  "cases": [
    {
      "id": "pd-01-ordinary-restart",
      "source_case_id": "pd-01-ordinary-restart",
      "workflow": ["orient"],
      "description": "Ordinary restart, no manifest. Both arms complete in a single bootstrap call; no expansion is required.",
      "arms": {
        "control": {
          "profile": "full",
          "bootstrap_response_mode": "legacy",
          "synthetic_request": {
            "project_id": "fixture-alpha",
            "query": "where were we",
            "include_global": false
          },
          "allowed_tool_names": ["__FROM_MIRROR__"],
          "prohibited_tool_names_or_families": [],
          "required_tool_calls": {
            "min_count": 1,
            "calls": [
              {
                "tool": "cognitive_agent_bootstrap",
                "args_predicates": [
                  { "pointer": "/project_id", "operator": "equals", "value": "fixture-alpha" },
                  { "pointer": "/include_global", "operator": "equals", "value": false }
                ],
                "response_predicates": [
                  { "pointer": "/practice/id", "operator": "equals", "value": "mem-graph-agent-practice" },
                  { "pointer": "/practice/status", "operator": "equals", "value": "adopted_advisory" },
                  { "pointer": "/practice/hard_enforcement", "operator": "equals", "value": false },
                  { "pointer": "/scope/project_id", "operator": "equals", "value": "fixture-alpha" },
                  { "pointer": "/scope/include_global", "operator": "equals", "value": false },
                  { "pointer": "/scope/global_inclusion", "operator": "equals", "value": "disabled" },
                  { "pointer": "/canonical_snapshot/requested_ids/0", "operator": "not_exists" },
                  { "pointer": "/canonical_snapshot/content_included", "operator": "equals", "value": false },
                  { "pointer": "/policy_lookup/trigger_type", "operator": "equals", "value": "request_type" },
                  { "pointer": "/policy_lookup/authority", "operator": "equals", "value": "candidate_only" },
                  { "pointer": "/verification/required", "operator": "equals", "value": true },
                  { "pointer": "/mutation/database_writes", "operator": "equals", "value": 0 },
                  { "pointer": "/mutation/events_appended", "operator": "equals", "value": 0 },
                  { "pointer": "/mutation/access_tracking", "operator": "equals", "value": "not_touched" },
                  { "pointer": "/mutation/receipt_persistence", "operator": "equals", "value": "none" }
                ]
              }
            ],
            "excluded_tools": []
          },
          "allowed_call_cardinality": { "min": 1, "max": 1 },
          "required_ordering_relationships": [
            { "type": "bootstrap_before_mutation", "predecessor": "cognitive_agent_bootstrap", "successor": "*" }
          ],
          "required_argument_predicates": [
            { "pointer": "/transcript/0/tool", "operator": "equals", "value": "cognitive_agent_bootstrap" },
            { "pointer": "/transcript/0/args/project_id", "operator": "equals", "value": "fixture-alpha" },
            { "pointer": "/transcript/0/args/include_global", "operator": "equals", "value": false }
          ],
          "response_predicates": [
            { "pointer": "/transcript/0/response_envelope/practice/id", "operator": "equals", "value": "mem-graph-agent-practice" },
            { "pointer": "/transcript/0/response_envelope/scope/project_id", "operator": "equals", "value": "fixture-alpha" },
            { "pointer": "/transcript/0/response_envelope/scope/include_global", "operator": "equals", "value": false },
            { "pointer": "/transcript/0/response_envelope/scope/global_inclusion", "operator": "equals", "value": "disabled" },
            { "pointer": "/transcript/0/response_envelope/mutation/database_writes", "operator": "equals", "value": 0 },
            { "pointer": "/transcript/0/response_envelope/mutation/access_tracking", "operator": "equals", "value": "not_touched" }
          ],
          "expected_scope": {
            "project_id": "fixture-alpha",
            "include_global": false,
            "global_inclusion": "disabled",
            "preserve_originating_scope": true
          },
          "expected_bootstrap_mutation_or_access_behavior": {
            "writes_database": false,
            "touches_access_tracking": false
          },
          "expected_expansion_behavior": {
            "must_call_required_expansions": true,
            "may_call_optional_expansions": false
          },
          "expected_outcome": "orient",
          "measurement_status": "contract-only-not-executed",
          "metric_policy": {
            "record_correctness": true,
            "record_initial_bytes": true,
            "record_total_context_bytes": true,
            "record_calls": true,
            "record_latency": true,
            "record_unsupported_arguments": true,
            "record_wrong_tool_attempts": true,
            "record_scope": true,
            "record_mutation_results": true,
            "exclude_latency_from_determinism": true,
            "claim_provider_token_savings": false,
            "applies_large_or_small_threshold": "small"
          }
        },
        "candidate": {
          "profile": "agent",
          "bootstrap_response_mode": "compact",
          "synthetic_request": {
            "project_id": "fixture-alpha",
            "query": "where were we",
            "include_global": false,
            "response_mode": "compact"
          },
          "allowed_tool_names": ["__FROM_AGENT_MIRROR__"],
          "prohibited_tool_names_or_families": [],
          "required_tool_calls": {
            "min_count": 1,
            "calls": [
              {
                "tool": "cognitive_agent_bootstrap",
                "args_predicates": [
                  { "pointer": "/project_id", "operator": "equals", "value": "fixture-alpha" },
                  { "pointer": "/include_global", "operator": "equals", "value": false },
                  { "pointer": "/response_mode", "operator": "equals", "value": "compact" }
                ],
                "response_predicates": [
                  { "pointer": "/disclosure_version", "operator": "equals", "value": "1.0.0" },
                  { "pointer": "/response_mode", "operator": "equals", "value": "compact" },
                  { "pointer": "/profile", "operator": "equals", "value": "agent" },
                  { "pointer": "/scope/project_id", "operator": "equals", "value": "fixture-alpha" },
                  { "pointer": "/scope/include_global", "operator": "equals", "value": false },
                  { "pointer": "/scope/global_inclusion", "operator": "equals", "value": "disabled" },
                  { "pointer": "/orientation/status", "operator": "equals", "value": "partial" },
                  { "pointer": "/orientation/requires_expansion", "operator": "equals", "value": true },
                  { "pointer": "/orientation/task_state", "operator": "equals", "value": "not_requested" },
                  { "pointer": "/task/objective/status", "operator": "equals", "value": "unresolved" },
                  { "pointer": "/task/objective/statement", "operator": "not_exists" },
                  { "pointer": "/task/definition_of_done/status", "operator": "equals", "value": "unresolved" },